{
  "domain": "physical",
  "system": "Motor shaft on a rolling-element bearing, with declared co-design feasibility",
  "carriers": [
    { "id": "torque", "layer": "energy", "dimension": "N·m" },
    { "id": "radial-load", "layer": "energy", "dimension": "N radial support" },
    { "id": "heat", "layer": "energy", "dimension": "W thermal" },
    { "id": "preload", "layer": "energy", "dimension": "N axial preload from thermal expansion" }
  ],
  "boxes": [
    { "id": "motor", "name": "Drive motor", "role": "tool", "action": "rotate",
      "outputs": [{ "id": "shaft-out", "carrier": "torque" }], "cost": { "usd_unit": 120 },
      "feasibility": [{ "provides": { "shaft-out": 12 } }] },
    { "id": "shaft", "name": "Shaft", "role": "product",
      "inputs": [{ "id": "drive", "carrier": "torque" }, { "id": "support", "carrier": "radial-load" }, { "id": "heat-in", "carrier": "heat" }],
      "outputs": [{ "id": "expansion", "carrier": "preload" }],
      "feasibility": [{ "requires": { "drive": 10, "support": 2500 } }] },
    { "id": "bearing", "name": "Ball bearing", "role": "mediator", "action": "support",
      "inputs": [{ "id": "preload-in", "carrier": "preload" }],
      "outputs": [{ "id": "race", "carrier": "radial-load" }, { "id": "friction", "carrier": "heat" }],
      "cost": { "usd_unit": 18, "service_h_year": 2 },
      "feasibility": [{ "provides": { "race": 3000 } }] },
    { "id": "housing", "name": "Housing", "role": "mediator", "action": "hold",
      "outputs": [{ "id": "bore", "carrier": "radial-load" }], "cost": { "usd_unit": 40 },
      "feasibility": [
        { "provides": { "bore": 400 } },
        { "provides": { "bore": 3000 }, "cost": { "usd_unit": 22, "service_h_year": 1 } }
      ] },
    { "id": "air", "name": "Ambient air", "role": "environment",
      "inputs": [{ "id": "sink", "carrier": "heat" }] }
  ],
  "wires": [
    { "id": "w-drive", "from": { "box": "motor", "port": "shaft-out" }, "to": { "box": "shaft", "port": "drive" }, "carrier": "torque", "polarity": "useful", "verb": "rotate" },
    { "id": "w-support", "from": { "box": "bearing", "port": "race" }, "to": { "box": "shaft", "port": "support" }, "carrier": "radial-load", "polarity": "useful", "verb": "support" },
    { "id": "w-heat", "from": { "box": "bearing", "port": "friction" }, "to": { "box": "shaft", "port": "heat-in" }, "carrier": "heat", "polarity": "harmful", "verb": "heat" },
    { "id": "w-preload", "from": { "box": "shaft", "port": "expansion" }, "to": { "box": "bearing", "port": "preload-in" }, "carrier": "preload", "polarity": "harmful", "verb": "overload" }
  ],
  "budget": { "usd_unit": 200, "service_h_year": 4 }
}
